{
  "$schema": "http://json-schema.org/draft-07/schema#",
  "$id": "https://walkthru-earth.github.io/opensensor-space-firmware/plugins/v0.1.0/board.json#",
  "title": "OpenSensor Board Manifest",
  "description": "One board variant, its template identity and the ordered module segments that make up its columns.",
  "type": "object",
  "required": ["type", "board_version", "board", "schema", "sample_interval_s", "segments"],
  "properties": {
    "type": {"const": "OpenSensorBoard"},
    "board_version": {"const": "0.1.0"},
    "board": {"type": "string", "pattern": "^[a-z0-9][a-z0-9-]{0,63}$"},
    "schema": {"type": "string", "pattern": "^[a-z0-9][a-z0-9-]{0,63}$"},
    "sample_interval_s": {"type": "number", "exclusiveMinimum": 0},
    "title": {"type": "string", "minLength": 1},
    "keywords": {"type": "array", "minItems": 1, "uniqueItems": true, "items": {"type": "string", "minLength": 1}},
    "local_modules": {
      "description": "Module manifests in the board app, relative to this file.",
      "type": "array",
      "uniqueItems": true,
      "items": {"type": "string", "pattern": "^(?!/)(?!.*\\.\\.)[A-Za-z0-9_./-]+\\.json$"}
    },
    "class_subsets": {
      "description": "Class names a board keeps for a column whose module lists more, such as the clock sources a board writes.",
      "type": "object",
      "propertyNames": {"pattern": "^[a-z][a-z0-9_]{0,63}$"},
      "additionalProperties": {"type": "array", "minItems": 1, "uniqueItems": true, "items": {"type": "string", "minLength": 1}}
    },
    "segments": {
      "type": "array",
      "minItems": 1,
      "items": {
        "type": "object",
        "required": ["module", "segment"],
        "properties": {
          "module": {"$ref": "module.json#/definitions/id"},
          "segment": {"$ref": "module.json#/definitions/id"}
        },
        "additionalProperties": false
      }
    }
  },
  "additionalProperties": false
}
